{
  "task_id": "t-000",
  "run_id": "r-0004",
  "worker": {
    "name": "http-collect",
    "version": null,
    "adapter_version": "0.2.0"
  },
  "status": "pass",
  "verdict": {
    "value": "pass",
    "verdict_source": "deterministic_assert",
    "gating": true,
    "confidence": null,
    "rationale": null
  },
  "findings": [],
  "metrics": {},
  "evidence": [
    {
      "kind": "raw_output",
      "uri": "runs/r-0004/t-000/outputs.json",
      "sha256": "b16565c47b222b1aaf091ad9d0b9cfe65262fc31fd60d14cab25d706580bd3b6"
    },
    {
      "kind": "raw_output",
      "uri": "runs/r-0004/t-000/collection.json",
      "sha256": "624ee4b4aff09e57050c56981f97929e2788f01e71fe8d466fb7130513fce1ab"
    },
    {
      "kind": "stdout",
      "uri": "runs/r-0004/t-000/stdout.log",
      "sha256": "e3b0c44298fc1c149afbf4c8996fb92427ae41e4649b934ca495991b7852b855"
    }
  ],
  "cost": {
    "wallclock_s": 0.158,
    "tokens": 0,
    "usd": 0.0
  },
  "sut_identity_ref": "sut-f560000f",
  "determinism": {
    "seed": null,
    "replay_cmd": "/Users/mac/Desktop/QC/QC-Agent/.venv/bin/python -m adapters.collect_worker --golden /Users/mac/Desktop/QC/QC-Agent/tests/eval/golden.json --out /Users/mac/Desktop/QC/QC-Agent/runs/r-0004/t-000/outputs.json --report /Users/mac/Desktop/QC/QC-Agent/runs/r-0004/t-000/collection.json"
  },
  "adapter_notes": [
    "http_status mô tả phản hồi summarize cuối; khi POST /notes lỗi, lưu status create",
    "HTTP collection chạy trong worker process và bị giới hạn bởi budget.wallclock_s"
  ]
}
