{
  "task_id": "t-canary-01",
  "run_id": "r-0004",
  "worker": {
    "name": "midscene-cli",
    "version": null,
    "adapter_version": "0.1.0"
  },
  "status": "fail",
  "verdict": {
    "value": "fail",
    "verdict_source": "deterministic_assert",
    "gating": false,
    "confidence": null,
    "rationale": null
  },
  "findings": [],
  "metrics": {},
  "evidence": [
    {
      "kind": "raw_output",
      "uri": "runs/r-0004/t-canary-01/summary.json",
      "sha256": "c0bb35a83f43a2be1d6db1fdcfe57ad948612106bfe88a7c51c10f6727e908b5"
    },
    {
      "kind": "raw_output",
      "uri": "runs/r-0004/t-canary-01/events.json",
      "sha256": "6620ebeded90f18fd70d8bc142a8199eba195e370bd7ba8f91c18ab27fd55032"
    },
    {
      "kind": "stdout",
      "uri": "runs/r-0004/t-canary-01/stdout.log",
      "sha256": "2ad0ef15604ccbc36e15396715b91a81bdfb9a3d001036b5aafeeedab2aa7a30"
    }
  ],
  "cost": {
    "wallclock_s": 6.844,
    "tokens": null,
    "usd": null
  },
  "sut_identity_ref": "sut-f560000f",
  "determinism": {
    "seed": null,
    "replay_cmd": null
  },
  "adapter_notes": [
    "PARSER_VERSION=1",
    "aiAssert không có confidence → không phát finding llm_judgment"
  ]
}
